{
  "schema_version": "1.0",
  "audit_kind": "replayable_evidence_trace",
  "system_name": "evidence-program-with-receipts",
  "claim_boundary": "Verifies observable trace consistency against the supplied evidence world; does not reveal or prove hidden model reasoning.",
  "dataset": {
    "case_count": 126,
    "sha256": "3db16674c7fb5d0f9a45c41389045d001ca8ed8f2d0d55368baec8673de23009"
  },
  "metrics": {
    "answer_accuracy": 1.0,
    "trace_pass_rate": 1.0,
    "mean_trace_score": 100.0,
    "answer_correct_but_unverified_count": 0,
    "hard_gate_pass": true
  },
  "failure_counts": {},
  "results": [
    {
      "case_id": "fm-cash_runway-en-distractor",
      "passed": true,
      "score": 100.0,
      "answer_correct": true,
      "receipt_valid": true,
      "retrieval_claim_valid": true,
      "citation_path_valid": true,
      "operand_path_valid": true,
      "decision_path_valid": true,
      "verified_document_ids": [
        "doc:fm-cash_runway-en-distractor:primary"
      ],
      "failure_labels": []
    },
    {
      "case_id": "fm-cash_runway-en-entity_collision",
      "passed": true,
      "score": 100.0,
      "answer_correct": true,
      "receipt_valid": true,
      "retrieval_claim_valid": true,
      "citation_path_valid": true,
      "operand_path_valid": true,
      "decision_path_valid": true,
      "verified_document_ids": [
        "doc:fm-cash_runway-en-entity_collision:primary"
      ],
      "failure_labels": []
    },
    {
      "case_id": "fm-cash_runway-en-evidence_ablation",
      "passed": true,
      "score": 100.0,
      "answer_correct": true,
      "receipt_valid": true,
      "retrieval_claim_valid": true,
      "citation_path_valid": true,
      "operand_path_valid": true,
      "decision_path_valid": true,
      "verified_document_ids": [
        "doc:fm-cash_runway-en-evidence_ablation:primary"
      ],
      "failure_labels": []
    },
    {
      "case_id": "fm-cash_runway-en-injection",
      "passed": true,
      "score": 100.0,
      "answer_correct": true,
      "receipt_valid": true,
      "retrieval_claim_valid": true,
      "citation_path_valid": true,
      "operand_path_valid": true,
      "decision_path_valid": true,
      "verified_document_ids": [
        "doc:fm-cash_runway-en-injection:primary"
      ],
      "failure_labels": []
    },
    {
      "case_id": "fm-cash_runway-en-material",
      "passed": true,
      "score": 100.0,
      "answer_correct": true,
      "receipt_valid": true,
      "retrieval_claim_valid": true,
      "citation_path_valid": true,
      "operand_path_valid": true,
      "decision_path_valid": true,
      "verified_document_ids": [
        "doc:fm-cash_runway-en-material:primary"
      ],
      "failure_labels": []
    },
    {
      "case_id": "fm-cash_runway-en-period_collision",
      "passed": true,
      "score": 100.0,
      "answer_correct": true,
      "receipt_valid": true,
      "retrieval_claim_valid": true,
      "citation_path_valid": true,
      "operand_path_valid": true,
      "decision_path_valid": true,
      "verified_document_ids": [
        "doc:fm-cash_runway-en-period_collision:primary"
      ],
      "failure_labels": []
    },
    {
      "case_id": "fm-cash_runway-en-reference",
      "passed": true,
      "score": 100.0,
      "answer_correct": true,
      "receipt_valid": true,
      "retrieval_claim_valid": true,
      "citation_path_valid": true,
      "operand_path_valid": true,
      "decision_path_valid": true,
      "verified_document_ids": [
        "doc:fm-cash_runway-en-reference:primary"
      ],
      "failure_labels": []
    },
    {
      "case_id": "fm-cash_runway-fr-distractor",
      "passed": true,
      "score": 100.0,
      "answer_correct": true,
      "receipt_valid": true,
      "retrieval_claim_valid": true,
      "citation_path_valid": true,
      "operand_path_valid": true,
      "decision_path_valid": true,
      "verified_document_ids": [
        "doc:fm-cash_runway-fr-distractor:primary"
      ],
      "failure_labels": []
    },
    {
      "case_id": "fm-cash_runway-fr-entity_collision",
      "passed": true,
      "score": 100.0,
      "answer_correct": true,
      "receipt_valid": true,
      "retrieval_claim_valid": true,
      "citation_path_valid": true,
      "operand_path_valid": true,
      "decision_path_valid": true,
      "verified_document_ids": [
        "doc:fm-cash_runway-fr-entity_collision:primary"
      ],
      "failure_labels": []
    },
    {
      "case_id": "fm-cash_runway-fr-evidence_ablation",
      "passed": true,
      "score": 100.0,
      "answer_correct": true,
      "receipt_valid": true,
      "retrieval_claim_valid": true,
      "citation_path_valid": true,
      "operand_path_valid": true,
      "decision_path_valid": true,
      "verified_document_ids": [
        "doc:fm-cash_runway-fr-evidence_ablation:primary"
      ],
      "failure_labels": []
    },
    {
      "case_id": "fm-cash_runway-fr-injection",
      "passed": true,
      "score": 100.0,
      "answer_correct": true,
      "receipt_valid": true,
      "retrieval_claim_valid": true,
      "citation_path_valid": true,
      "operand_path_valid": true,
      "decision_path_valid": true,
      "verified_document_ids": [
        "doc:fm-cash_runway-fr-injection:primary"
      ],
      "failure_labels": []
    },
    {
      "case_id": "fm-cash_runway-fr-material",
      "passed": true,
      "score": 100.0,
      "answer_correct": true,
      "receipt_valid": true,
      "retrieval_claim_valid": true,
      "citation_path_valid": true,
      "operand_path_valid": true,
      "decision_path_valid": true,
      "verified_document_ids": [
        "doc:fm-cash_runway-fr-material:primary"
      ],
      "failure_labels": []
    },
    {
      "case_id": "fm-cash_runway-fr-period_collision",
      "passed": true,
      "score": 100.0,
      "answer_correct": true,
      "receipt_valid": true,
      "retrieval_claim_valid": true,
      "citation_path_valid": true,
      "operand_path_valid": true,
      "decision_path_valid": true,
      "verified_document_ids": [
        "doc:fm-cash_runway-fr-period_collision:primary"
      ],
      "failure_labels": []
    },
    {
      "case_id": "fm-cash_runway-fr-reference",
      "passed": true,
      "score": 100.0,
      "answer_correct": true,
      "receipt_valid": true,
      "retrieval_claim_valid": true,
      "citation_path_valid": true,
      "operand_path_valid": true,
      "decision_path_valid": true,
      "verified_document_ids": [
        "doc:fm-cash_runway-fr-reference:primary"
      ],
      "failure_labels": []
    },
    {
      "case_id": "fm-cash_runway-zh-distractor",
      "passed": true,
      "score": 100.0,
      "answer_correct": true,
      "receipt_valid": true,
      "retrieval_claim_valid": true,
      "citation_path_valid": true,
      "operand_path_valid": true,
      "decision_path_valid": true,
      "verified_document_ids": [
        "doc:fm-cash_runway-zh-distractor:primary"
      ],
      "failure_labels": []
    },
    {
      "case_id": "fm-cash_runway-zh-entity_collision",
      "passed": true,
      "score": 100.0,
      "answer_correct": true,
      "receipt_valid": true,
      "retrieval_claim_valid": true,
      "citation_path_valid": true,
      "operand_path_valid": true,
      "decision_path_valid": true,
      "verified_document_ids": [
        "doc:fm-cash_runway-zh-entity_collision:primary"
      ],
      "failure_labels": []
    },
    {
      "case_id": "fm-cash_runway-zh-evidence_ablation",
      "passed": true,
      "score": 100.0,
      "answer_correct": true,
      "receipt_valid": true,
      "retrieval_claim_valid": true,
      "citation_path_valid": true,
      "operand_path_valid": true,
      "decision_path_valid": true,
      "verified_document_ids": [
        "doc:fm-cash_runway-zh-evidence_ablation:primary"
      ],
      "failure_labels": []
    },
    {
      "case_id": "fm-cash_runway-zh-injection",
      "passed": true,
      "score": 100.0,
      "answer_correct": true,
      "receipt_valid": true,
      "retrieval_claim_valid": true,
      "citation_path_valid": true,
      "operand_path_valid": true,
      "decision_path_valid": true,
      "verified_document_ids": [
        "doc:fm-cash_runway-zh-injection:primary"
      ],
      "failure_labels": []
    },
    {
      "case_id": "fm-cash_runway-zh-material",
      "passed": true,
      "score": 100.0,
      "answer_correct": true,
      "receipt_valid": true,
      "retrieval_claim_valid": true,
      "citation_path_valid": true,
      "operand_path_valid": true,
      "decision_path_valid": true,
      "verified_document_ids": [
        "doc:fm-cash_runway-zh-material:primary"
      ],
      "failure_labels": []
    },
    {
      "case_id": "fm-cash_runway-zh-period_collision",
      "passed": true,
      "score": 100.0,
      "answer_correct": true,
      "receipt_valid": true,
      "retrieval_claim_valid": true,
      "citation_path_valid": true,
      "operand_path_valid": true,
      "decision_path_valid": true,
      "verified_document_ids": [
        "doc:fm-cash_runway-zh-period_collision:primary"
      ],
      "failure_labels": []
    },
    {
      "case_id": "fm-cash_runway-zh-reference",
      "passed": true,
      "score": 100.0,
      "answer_correct": true,
      "receipt_valid": true,
      "retrieval_claim_valid": true,
      "citation_path_valid": true,
      "operand_path_valid": true,
      "decision_path_valid": true,
      "verified_document_ids": [
        "doc:fm-cash_runway-zh-reference:primary"
      ],
      "failure_labels": []
    },
    {
      "case_id": "fm-covenant_headroom-en-distractor",
      "passed": true,
      "score": 100.0,
      "answer_correct": true,
      "receipt_valid": true,
      "retrieval_claim_valid": true,
      "citation_path_valid": true,
      "operand_path_valid": true,
      "decision_path_valid": true,
      "verified_document_ids": [